{
  "protocol": "asterion.operation/v1",
  "receipt_id": "receipt-purpose-1",
  "operation_id": "operation-purpose-1",
  "request_ref": "request-purpose-1",
  "request_sha256": "aaaaaaaaaaaaaaaaaaaaaaaaaaaaaaaaaaaaaaaaaaaaaaaaaaaaaaaaaaaaaaaa",
  "purpose": "operation.auth.read",
  "session_id": "session-1",
  "client_id": "client-1",
  "generation": 1,
  "authority_revision": 1,
  "authority_id": "authority-1",
  "idempotency_key": "idempotency-purpose-1",
  "feature_id": "operation.auth",
  "status": "succeeded",
  "reason_code": "operation-succeeded",
  "receipt_ref": "receipt-public-purpose-1",
  "reconciliation_ref": null,
  "effect_counts": {
    "credential_value_reads": 0,
    "provider_model_requests": 0,
    "network_operations": 0,
    "package_manager_operations": 0,
    "os_process_restart_operations": 0,
    "external_telemetry_deliveries": 0,
    "uploads": 0
  },
  "completed_at": "2026-08-10T15:00:01Z"
}
